{
  "$schema": "./schemas/psalm-theme.schema.json",
  "game": "psalm-theme",
  "version": 1,
  "displayName": "Psalm Theme Challenge",
  "roundsPerSession": 10,
  "sessions": [
    {
      "id": "pt-session-01",
      "title": "Psalm Themes",
      "theme": "Identify major themes in short Psalm excerpts.",
      "rounds": [
        {
          "id": "pt-001",
          "title": "Psalm 1:1-3",
          "reference": "Psalm 1:1-3",
          "excerpt": "Blessed is the man... he shall be like a tree planted by the rivers of water.",
          "correctTheme": "Blessing",
          "choices": [
            "Blessing",
            "Praise",
            "Trust",
            "Lament"
          ],
          "difficulty": "easy",
          "teachingNote": "Psalm 1 contrasts the blessed way with the way of the ungodly."
        },
        {
          "id": "pt-002",
          "title": "Psalm 8:1-4",
          "reference": "Psalm 8:1-4",
          "excerpt": "O Lord our Lord, how excellent is thy name in all the earth!",
          "correctTheme": "Praise",
          "choices": [
            "Praise",
            "Trust",
            "Lament",
            "Repentance"
          ],
          "difficulty": "easy",
          "teachingNote": "Psalm 8 praises God's majesty and mindful care."
        },
        {
          "id": "pt-003",
          "title": "Psalm 19:1",
          "reference": "Psalm 19:1",
          "excerpt": "The heavens declare the glory of God; and the firmament sheweth his handywork.",
          "correctTheme": "Creation",
          "choices": [
            "Creation",
            "Lament",
            "Repentance",
            "Thanksgiving"
          ],
          "difficulty": "easy",
          "teachingNote": "Creation witnesses to God's glory."
        },
        {
          "id": "pt-004",
          "title": "Psalm 19:7",
          "reference": "Psalm 19:7",
          "excerpt": "The law of the Lord is perfect, converting the soul.",
          "correctTheme": "God's Word",
          "choices": [
            "God's Word",
            "Repentance",
            "Thanksgiving",
            "Creation"
          ],
          "difficulty": "easy",
          "teachingNote": "The Psalm turns from creation to the perfection of God's word."
        },
        {
          "id": "pt-005",
          "title": "Psalm 23:1-4",
          "reference": "Psalm 23:1-4",
          "excerpt": "The Lord is my shepherd; I shall not want.",
          "correctTheme": "Shepherd / Guidance",
          "choices": [
            "Shepherd / Guidance",
            "Thanksgiving",
            "Creation",
            "Deliverance"
          ],
          "difficulty": "easy",
          "teachingNote": "The Lord is pictured as shepherd, provider, and guide."
        },
        {
          "id": "pt-006",
          "title": "Psalm 24:1",
          "reference": "Psalm 24:1",
          "excerpt": "The earth is the Lord's, and the fulness thereof.",
          "correctTheme": "God's Kingship",
          "choices": [
            "God's Kingship",
            "Creation",
            "Deliverance",
            "Protection"
          ],
          "difficulty": "easy",
          "teachingNote": "The Psalm announces the Lord's ownership over creation."
        },
        {
          "id": "pt-007",
          "title": "Psalm 27:1",
          "reference": "Psalm 27:1",
          "excerpt": "The Lord is my light and my salvation; whom shall I fear?",
          "correctTheme": "Trust",
          "choices": [
            "Trust",
            "Deliverance",
            "Protection",
            "Worship"
          ],
          "difficulty": "easy",
          "teachingNote": "The Lord's salvation becomes the ground of confidence."
        },
        {
          "id": "pt-008",
          "title": "Psalm 32:1",
          "reference": "Psalm 32:1",
          "excerpt": "Blessed is he whose transgression is forgiven, whose sin is covered.",
          "correctTheme": "Repentance",
          "choices": [
            "Repentance",
            "Protection",
            "Worship",
            "God's Word"
          ],
          "difficulty": "easy",
          "teachingNote": "Forgiveness is the blessing at the center of the Psalm."
        },
        {
          "id": "pt-009",
          "title": "Psalm 34:1",
          "reference": "Psalm 34:1",
          "excerpt": "I will bless the Lord at all times: his praise shall continually be in my mouth.",
          "correctTheme": "Praise",
          "choices": [
            "Praise",
            "Worship",
            "God's Word",
            "God's Kingship"
          ],
          "difficulty": "easy",
          "teachingNote": "The speaker commits to constant praise."
        },
        {
          "id": "pt-010",
          "title": "Psalm 34:8",
          "reference": "Psalm 34:8",
          "excerpt": "O taste and see that the Lord is good.",
          "correctTheme": "Trust",
          "choices": [
            "Trust",
            "God's Word",
            "God's Kingship",
            "Shepherd / Guidance"
          ],
          "difficulty": "medium",
          "teachingNote": "The excerpt invites trust in God's goodness."
        },
        {
          "id": "pt-011",
          "title": "Psalm 42:1",
          "reference": "Psalm 42:1",
          "excerpt": "As the hart panteth after the water brooks, so panteth my soul after thee, O God.",
          "correctTheme": "Prayer",
          "choices": [
            "Prayer",
            "God's Kingship",
            "Shepherd / Guidance",
            "Justice"
          ],
          "difficulty": "medium",
          "teachingNote": "The Psalm gives voice to deep longing for God."
        },
        {
          "id": "pt-012",
          "title": "Psalm 46:1",
          "reference": "Psalm 46:1",
          "excerpt": "God is our refuge and strength, a very present help in trouble.",
          "correctTheme": "Protection",
          "choices": [
            "Protection",
            "Shepherd / Guidance",
            "Justice",
            "Comfort"
          ],
          "difficulty": "medium",
          "teachingNote": "God is confessed as refuge in trouble."
        },
        {
          "id": "pt-013",
          "title": "Psalm 51:10",
          "reference": "Psalm 51:10",
          "excerpt": "Create in me a clean heart, O God; and renew a right spirit within me.",
          "correctTheme": "Repentance",
          "choices": [
            "Repentance",
            "Justice",
            "Comfort",
            "Prayer"
          ],
          "difficulty": "medium",
          "teachingNote": "The prayer asks for cleansing and renewal."
        },
        {
          "id": "pt-014",
          "title": "Psalm 63:1",
          "reference": "Psalm 63:1",
          "excerpt": "O God, thou art my God; early will I seek thee.",
          "correctTheme": "Prayer",
          "choices": [
            "Prayer",
            "Comfort",
            "Blessing",
            "Praise"
          ],
          "difficulty": "medium",
          "teachingNote": "The Psalm expresses earnest seeking after God."
        },
        {
          "id": "pt-015",
          "title": "Psalm 91:1-2",
          "reference": "Psalm 91:1-2",
          "excerpt": "He is my refuge and my fortress: my God; in him will I trust.",
          "correctTheme": "Protection",
          "choices": [
            "Protection",
            "Prayer",
            "Blessing",
            "Praise"
          ],
          "difficulty": "medium",
          "teachingNote": "The Psalm centers on shelter and trust."
        },
        {
          "id": "pt-016",
          "title": "Psalm 95:1-2",
          "reference": "Psalm 95:1-2",
          "excerpt": "O come, let us sing unto the Lord: let us make a joyful noise to the rock of our salvation.",
          "correctTheme": "Worship",
          "choices": [
            "Worship",
            "Blessing",
            "Praise",
            "Trust"
          ],
          "difficulty": "medium",
          "teachingNote": "The excerpt calls God's people to worship."
        },
        {
          "id": "pt-017",
          "title": "Psalm 100:1-4",
          "reference": "Psalm 100:1-4",
          "excerpt": "Enter into his gates with thanksgiving, and into his courts with praise.",
          "correctTheme": "Thanksgiving",
          "choices": [
            "Thanksgiving",
            "Praise",
            "Trust",
            "Lament"
          ],
          "difficulty": "medium",
          "teachingNote": "Thanksgiving marks the approach to worship."
        },
        {
          "id": "pt-018",
          "title": "Psalm 103:1-2",
          "reference": "Psalm 103:1-2",
          "excerpt": "Bless the Lord, O my soul, and forget not all his benefits.",
          "correctTheme": "Praise",
          "choices": [
            "Praise",
            "Trust",
            "Lament",
            "Repentance"
          ],
          "difficulty": "medium",
          "teachingNote": "The Psalm calls the soul to remember and bless the Lord."
        },
        {
          "id": "pt-019",
          "title": "Psalm 107:1",
          "reference": "Psalm 107:1",
          "excerpt": "O give thanks unto the Lord, for he is good: for his mercy endureth for ever.",
          "correctTheme": "Thanksgiving",
          "choices": [
            "Thanksgiving",
            "Lament",
            "Repentance",
            "Creation"
          ],
          "difficulty": "hard",
          "teachingNote": "The verse gives thanks for enduring mercy."
        },
        {
          "id": "pt-020",
          "title": "Psalm 118:24",
          "reference": "Psalm 118:24",
          "excerpt": "This is the day which the Lord hath made; we will rejoice and be glad in it.",
          "correctTheme": "Praise",
          "choices": [
            "Praise",
            "Repentance",
            "Thanksgiving",